{
  "id": "OL-001",
  "status": "draft",
  "title": "B-M",
  "author": "Founding dataset",
  "createdAt": "2026-07-27",
  "oak": {
    "type": "B-M",
    "species": null,
    "origin": null,
    "form": "chips",
    "particleSize": null,
    "toast": "Medium",
    "preparation": {
      "soaking": "24 h",
      "boiling": "20 min",
      "rinsing": null,
      "drying": null,
      "notes": "160 °C 60 min; 190 °C 45 min"
    }
  },
  "liquid": {
    "base": "sugar distillate",
    "abv": 55,
    "volumeMl": 300
  },
  "extraction": {
    "doseGPerL": 8.333333,
    "durationDays": 35,
    "temperatureC": null,
    "container": "glass jar",
    "agitation": "periodic shaking",
    "notes": "First comparative series; 2.5 g oak per 300 ml. Additional components not used."
  },
  "observations": {
    "appearance": "Фото 04.09.2026: прозрачный золотисто-янтарный оттенок, светлый.",
    "aroma": null,
    "taste": null,
    "mouthfeel": null,
    "overallNotes": "Initial founding entry. Complete from original lab notes before public release.",
    "color": {
      "hex": "#DA914A",
      "rgb": "218, 145, 74",
      "srm": 7.2,
      "source": "OakLab visual color record"
    }
  },
  "replication": {
    "sourceId": null
  },
  "evidence": {
    "photos": [
      "first-tasting-photo-set-2026-09-04"
    ],
    "attachments": [],
    "sourceNotes": "First tasting visual evidence: three uploaded photos dated 04.09.2026 showing samples 1–8. Visual appearance notes are descriptive only and are not sensory scores."
  },
  "schemaVersion": 2,
  "tastingSessions": [
    {
      "date": "2026-09-04",
      "agingDays": 35,
      "order": 1,
      "scores": {
        "aroma": 1,
        "softness": 1,
        "oak": 1,
        "vanilla": 1,
        "caramelToast": 1,
        "fruitNut": 1,
        "smokeChar": 1,
        "spirit": 1,
        "bitterness": 1,
        "astringency": 1
      },
      "total": 10,
      "overall": 1,
      "notes": "First tasting — new scoring system. Transcribed from the tasting journal dated 04.09.2026."
    },
    {
      "date": "2026-09-25",
      "agingDays": 61,
      "order": 1,
      "scores": {
        "aroma": 1,
        "spirit": 1,
        "softness": 0,
        "oak": 2,
        "vanilla": 0,
        "caramelToast": 0,
        "fruitNut": 0,
        "smokeChar": 2,
        "bitterness": 2,
        "astringency": 2
      },
      "total": 12,
      "overall": 2,
      "notes": "Second independent tasting — Alexander; 25.09.2026; 2 months aging. Scores transcribed from the tasting sheet. Overall impression is separate and excluded from total 0–50."
    }
  ]
}
