{
  "id": "OL-008",
  "status": "draft",
  "title": "A-M+",
  "author": "Founding dataset",
  "createdAt": "2026-07-27",
  "oak": {
    "type": "A-M+",
    "species": null,
    "origin": null,
    "form": "chips",
    "particleSize": null,
    "toast": "Medium+",
    "preparation": {
      "soaking": "48 h",
      "boiling": "30 min",
      "rinsing": null,
      "drying": null,
      "notes": "170 °C 60 min; 200 °C 60 min"
    }
  },
  "liquid": {
    "base": "sugar distillate",
    "abv": 55,
    "volumeMl": 300
  },
  "extraction": {
    "doseGPerL": 8.333333,
    "durationDays": 35,
    "temperatureC": null,
    "container": "glass jar",
    "agitation": "periodic shaking",
    "notes": "First comparative series; 2.5 g oak per 300 ml. Additional components not used."
  },
  "observations": {
    "appearance": "Фото 04.09.2026: светлый золотисто-янтарный оттенок.",
    "aroma": null,
    "taste": null,
    "mouthfeel": null,
    "overallNotes": "Preparation recorded from the current project notes; other parameters remain unfilled until verified.",
    "color": {
      "hex": "#8C1201",
      "rgb": "140, 18, 1",
      "srm": 12,
      "source": "OakLab visual color record"
    }
  },
  "replication": {
    "sourceId": null
  },
  "evidence": {
    "photos": [
      "first-tasting-photo-set-2026-09-04"
    ],
    "attachments": [],
    "sourceNotes": "First tasting visual evidence: three uploaded photos dated 04.09.2026 showing samples 1–8. Visual appearance notes are descriptive only and are not sensory scores."
  },
  "schemaVersion": 2,
  "tastingSessions": [
    {
      "date": "2026-09-04",
      "agingDays": 35,
      "order": 4,
      "scores": {
        "aroma": 4,
        "softness": 4,
        "oak": 5,
        "vanilla": 3,
        "caramelToast": 5,
        "fruitNut": 1,
        "smokeChar": 1,
        "spirit": 2,
        "bitterness": 5,
        "astringency": 4
      },
      "total": 34,
      "overall": 8,
      "notes": "First tasting — new scoring system. Transcribed from the tasting journal dated 04.09.2026."
    }
  ]
}
