{
  "id": "OL-004",
  "status": "draft",
  "title": "C-M",
  "author": "Founding dataset",
  "createdAt": "2026-07-27",
  "oak": {
    "type": "C-M",
    "species": null,
    "origin": null,
    "form": "chips",
    "particleSize": null,
    "toast": "Medium",
    "preparation": {
      "soaking": "24 h",
      "boiling": "15 min",
      "rinsing": null,
      "drying": null,
      "notes": "160 °C 60 min; 190 °C 45 min"
    }
  },
  "liquid": {
    "base": "sugar distillate",
    "abv": 55,
    "volumeMl": 300
  },
  "extraction": {
    "doseGPerL": 8.333333,
    "durationDays": 35,
    "temperatureC": null,
    "container": "glass jar",
    "agitation": "periodic shaking",
    "notes": "First comparative series; 2.5 g oak per 300 ml. Additional components not used."
  },
  "observations": {
    "appearance": "Фото 04.09.2026: янтарный оттенок средней насыщенности, прозрачный.",
    "aroma": null,
    "taste": null,
    "mouthfeel": null,
    "overallNotes": "Initial founding entry.",
    "color": {
      "hex": "#860E01",
      "rgb": "134, 14, 1",
      "srm": 11.8,
      "source": "OakLab visual color record"
    }
  },
  "replication": {
    "sourceId": null
  },
  "evidence": {
    "photos": [
      "first-tasting-photo-set-2026-09-04"
    ],
    "attachments": [],
    "sourceNotes": "First tasting visual evidence: three uploaded photos dated 04.09.2026 showing samples 1–8. Visual appearance notes are descriptive only and are not sensory scores."
  },
  "schemaVersion": 2,
  "tastingSessions": [
    {
      "date": "2026-09-04",
      "agingDays": 35,
      "order": 5,
      "scores": {
        "aroma": 4,
        "softness": 4,
        "oak": 5,
        "vanilla": 2,
        "caramelToast": 4,
        "fruitNut": 1,
        "smokeChar": 1,
        "spirit": 1,
        "bitterness": 5,
        "astringency": 4
      },
      "total": 31,
      "overall": 9,
      "notes": "First tasting — new scoring system. Transcribed from the tasting journal dated 04.09.2026. Tasting conducted by Сергей и Вова; one joint result."
    },
    {
      "date": "2026-09-25",
      "agingDays": 61,
      "order": 5,
      "scores": {
        "aroma": 2,
        "spirit": 4,
        "softness": 2,
        "oak": 2,
        "vanilla": 3,
        "caramelToast": 3,
        "fruitNut": 2,
        "smokeChar": 2,
        "bitterness": 1,
        "astringency": 4
      },
      "total": 25,
      "overall": 7,
      "notes": "Second independent tasting — Александр; 25.09.2026; 2 months aging. One joint result. Scores transcribed from the tasting sheet. Overall impression is separate and excluded from total 0–50."
    }
  ]
}
