{
  "id": "OL-005",
  "status": "draft",
  "title": "A-HC",
  "author": "Founding dataset",
  "createdAt": "2026-07-27",
  "oak": {
    "type": "A-HC",
    "species": null,
    "origin": null,
    "form": "chips",
    "particleSize": null,
    "toast": "Char",
    "preparation": {
      "soaking": "48 h",
      "boiling": "30 min",
      "rinsing": null,
      "drying": null,
      "notes": "160 °C 45 min; 190 °C 45 min; 220 °C 45–60 min"
    }
  },
  "liquid": {
    "base": "sugar distillate",
    "abv": 55,
    "volumeMl": 300
  },
  "extraction": {
    "doseGPerL": 8.333333,
    "durationDays": 35,
    "temperatureC": null,
    "container": "glass jar",
    "agitation": "periodic shaking",
    "notes": "First comparative series; 2.5 g oak per 300 ml. Additional components not used."
  },
  "observations": {
    "appearance": null,
    "aroma": null,
    "taste": null,
    "mouthfeel": null,
    "overallNotes": "Initial founding entry."
  },
  "replication": {
    "sourceId": null
  },
  "evidence": {
    "photos": [],
    "attachments": [],
    "sourceNotes": null
  },
  "schemaVersion": 2,
  "tastingSessions": [
    {
      "date": "2026-09-04",
      "agingDays": 35,
      "order": 6,
      "scores": {
        "aroma": 4,
        "softness": 3,
        "oak": 3,
        "vanilla": 4,
        "caramelToast": 3,
        "fruitNut": 1,
        "smokeChar": 1,
        "spirit": 1,
        "bitterness": 4,
        "astringency": 4
      },
      "total": 28,
      "overall": 7,
      "notes": "First tasting — new scoring system. Transcribed from the tasting journal dated 04.09.2026."
    }
  ]
}
